idtarea,Tipo Tarea,Generica,Nombre de Lista,Nombre Tarea,Prioridad
204,2,1,125,Realizar reuniones Semanales y mensuales con los técnicos.,1
86,3,1,126,Recibir y revisar Ots,2
87,3,1,126,Solucionar errores en las Ots con las regionales,1
330,2,1,127,Liderar la parametrización y mejoras de SAIA,2
184,3,1,128,Elaborar propuesta de incremento de salarios y pasar a Gerencia,2
185,2,1,128,Elaborar cartas de incremento de salario; hacer firmar y enviar a empleados,1
331,3,1,129,Parametrizar fllujo de documentos en SAMM,2
332,2,1,129,Reportar y gestionar solución fallas en sistema,3
333,3,1,129,Gestionar bases de datos de samm (perfiles; equipos; modelos; actividades; etc),2
349,3,1,130,Seguimiento al 2 del programa de preventivo;,2
350,3,1,130,Monitorear las Ots correspondientes a mantenimiento general;,2
351,2,1,130,Validar ots de preventivo ejecutadas versus las programadas y lo reportado en indicadores; aclarar diferencias  y enviar informe mensual a jefes mtto; jefe operaciones y dir mtto,1
352,2,1,130,Validar equipos en contrato de preventivo sin ejecución del mismo en mayo y noviembre,1
353,3,1,131,Realizar seguimiento a las solicitudes de servicio pendientes;,2
88,2,1,132,Elaborar informe de facturación por cliente,1
89,2,1,132,Llevar indicadores de errores de Ots y pasar informe mensual,1
90,2,1,132,Realizar seguimiento semanal a ots abiertas y enviar informe a Jefes  y Dir mtto; Dir Financiera,1
91,2,1,132,Realizar validación semanal de ots en estado por facturar y que no ha recibido y solicitarlas,2
92,2,1,132,Pasar informes sobre irregularidades en el proceso de gestión de Ots.,1
93,2,1,132,Pasar informe semanal de facturación a Jefes de Mtto y Gerencia,1
94,2,1,132,Revisión del cierre semanal de facturación,2
95,2,1,132,Revisión del cierre mensual de facturación y pasar informe a Gerencia,2
96,2,1,132,Revisión del cierre mensual de facturación,2
97,2,1,132,Revisión del cierre mensual de facturación,2
354,3,1,133,Revisar ordenes en stand by y pasar informe,3
355,3,1,133,Supervisar casos especiales y pasar informe,2
356,3,1,133,Monitorear estado de las Ots y generar mejoras con los jefe de mtto,2
357,3,1,133,Monitorear el oportuno cierre de órdenes de trabajo,3
186,2,1,134,Liquidación y pago de seguridad social;previo visto bueno de J. Gestión Humana,3
187,2,1,134,Revisión y autorización de pago de liquidación de seguridad social,3
188,2,1,134,Generación de certificados de pagos de seguridad social y enviar a las regionales los correspondientes a  técnicos y jefes mtto.,2
189,3,1,134,Realizar cobro de incapacidades,1
190,3,1,134,Realizar afiliaciones y desafiliaciones EPS; AFP; ARL  ; ETC,3
152,2,1,135,Solicitar el cubrimiento de una vacante o un nuevo cargo,3
153,2,1,135,Realizar entrevistas a candidatos,3
216,3,1,136,Planear y liderar ejecución del Sistema de Gestión de Seguridad en el trabajo.,2
191,2,1,137,Coordinar en noviembre programa anual de vacaciones de todo el personal (técnicos no deben tener vacaciones desde 1 de abril hasta después de dia de madres),2
14,2,1,138,Visitas a Clientes para seguimiento a servicio,2
15,2,1,139,Realizar visitas de seguimiento a servicio y nuevas oportunidades al cliente,1
196,2,1,140,Realizar visitas a las regionales para dar información del área; validar clima laboral y recoger inquietudes y sugerencias,2
358,2,1,141,Realizar visitas de seguimiento a las regionales y técnicos satélites,1